{
  "match_id": "brasileirao-2026-r24-fla-flu",
  "competition": "Brasileirão",
  "kickoff_iso": "2026-09-13T16:00:00-03:00",
  "home": "Flamengo",
  "away": "Fluminense",
  "venue": "Maracanã",
  "status": "live",
  "score_home": 1,
  "score_away": 0,
  "lineup_confirmed": true,
  "broadcast": ["Globo", "Premiere"]
}
