{
  "match_id": "brasileirao-2026-r24-fla-flu",
  "competition": "Brasileirão",
  "kickoff_iso": "2026-09-13T16:00:00-03:00",
  "home": "Flamengo",
  "away": "Fluminense",
  "venue": "Maracanã",
  "status": "scheduled",
  "score_home": null,
  "score_away": null,
  "lineup_confirmed": false,
  "broadcast": ["Globo", "Premiere"]
}
